{"containsPrivateContent":false,"kind":"corpus-manifest","manifestID":"product-synthetic-alpha-asr-v1","releaseHoldout":false,"samples":[{"assetReference":"local-corpus://product-synthetic/alpha-asr-v1/zh-baseline","consentClass":"synthetic","contentDigest":"68530d6e2d2dd493e3501d5d95f42b2f9dff5ab4507055d7ad6ca611c8af9468","languages":["zh-CN"],"sampleUUID":"21000000-0000-4000-8000-000000000001","tags":["asr","baseline","local-only","mandarin","punctuation"]},{"assetReference":"local-corpus://product-synthetic/alpha-asr-v1/en-baseline","consentClass":"synthetic","contentDigest":"e3376eed48b8e8ef0fe83a95844090221164797a981859f26a66f2de1f0548e2","languages":["en-US"],"sampleUUID":"21000000-0000-4000-8000-000000000002","tags":["asr","baseline","english","local-only","punctuation"]},{"assetReference":"local-corpus://product-synthetic/alpha-asr-v1/mixed-dangerous","consentClass":"synthetic","contentDigest":"f2d3a9c71dd0f1951dc93490d5a18511f60c00cfa0134cec4b95800322945bbc","languages":["zh-CN","en-US"],"sampleUUID":"21000000-0000-4000-8000-000000000003","tags":["asr","code-switch","local-only","mixed-language","numbers-dates-negation"]},{"assetReference":"local-corpus://product-synthetic/alpha-asr-v1/zh-names-terms","consentClass":"synthetic","contentDigest":"dad9ce269f8a79320bfe40dde3804e0af8268f28816fa2e34e0e9eeb92b56d98","languages":["zh-CN"],"sampleUUID":"21000000-0000-4000-8000-000000000004","tags":["asr","dictionary","local-only","mandarin","names-terms"]},{"assetReference":"local-corpus://product-synthetic/alpha-asr-v1/en-names-terms","consentClass":"synthetic","contentDigest":"66c4c75f81a2fbb994c763dde78348b6193749631148a5fe07060d292ea34a71","languages":["en-US"],"sampleUUID":"21000000-0000-4000-8000-000000000005","tags":["asr","dictionary","english","local-only","names-terms"]},{"assetReference":"local-corpus://product-synthetic/alpha-asr-v1/zh-numbers-date-negation","consentClass":"synthetic","contentDigest":"457c9efa9dbcaaeadd572eec996d57cfe987de5065829780eef1bcdb7fffbac7","languages":["zh-CN"],"sampleUUID":"21000000-0000-4000-8000-000000000006","tags":["asr","local-only","mandarin","numbers-dates-negation"]},{"assetReference":"local-corpus://product-synthetic/alpha-asr-v1/en-numbers-date-negation","consentClass":"synthetic","contentDigest":"d592bf694f7dcf9a45567e66048b0b56257f931fc9e6843c66a23f43caeeb643","languages":["en-US"],"sampleUUID":"21000000-0000-4000-8000-000000000007","tags":["asr","english","local-only","numbers-dates-negation"]},{"assetReference":"local-corpus://product-synthetic/alpha-asr-v1/zh-fast-pace","consentClass":"synthetic","contentDigest":"7f0be89c7d0d561fbef18b35bf15e0887fadfc5a3854f231519ffe98279ce380","languages":["zh-CN"],"sampleUUID":"21000000-0000-4000-8000-000000000008","tags":["asr","fast","local-only","mandarin","pace"]},{"assetReference":"local-corpus://product-synthetic/alpha-asr-v1/en-slow-pace","consentClass":"synthetic","contentDigest":"e0a4806c0aef3ab60f77a31274b7bb0dc2d10c1168d792997bcc116794f49774","languages":["en-US"],"sampleUUID":"21000000-0000-4000-8000-000000000009","tags":["asr","english","local-only","pace","slow"]},{"assetReference":"local-corpus://product-synthetic/alpha-asr-v1/zh-explicit-pause","consentClass":"synthetic","contentDigest":"836713c9f682f0b162bf10102082bbad5472fddd36164be1876570a9c8dd2d38","languages":["zh-CN"],"sampleUUID":"21000000-0000-4000-8000-000000000010","tags":["asr","local-only","mandarin","pause"]},{"assetReference":"local-corpus://product-synthetic/alpha-asr-v1/en-explicit-pause","consentClass":"synthetic","contentDigest":"25949f121e6daf5546d0e0745d77911d0c1da6dddf63a106ec772fe0c818eed9","languages":["en-US"],"sampleUUID":"21000000-0000-4000-8000-000000000011","tags":["asr","english","local-only","pause"]},{"assetReference":"local-corpus://product-synthetic/alpha-asr-v1/zh-self-correction","consentClass":"synthetic","contentDigest":"1a7451614330d75a0e93f184862dbca39effd06244d18846136e8cbdffb0be44","languages":["zh-CN"],"sampleUUID":"21000000-0000-4000-8000-000000000012","tags":["asr","local-only","mandarin","self-correction"]},{"assetReference":"local-corpus://product-synthetic/alpha-asr-v1/en-self-correction","consentClass":"synthetic","contentDigest":"c2b244c503270ea41a9a0ac677eaf31b1eb3c8dfaff126c5a19a945f801c7951","languages":["en-US"],"sampleUUID":"21000000-0000-4000-8000-000000000013","tags":["asr","english","local-only","self-correction"]},{"assetReference":"local-corpus://product-synthetic/alpha-asr-v1/mixed-self-correction","consentClass":"synthetic","contentDigest":"0647eecae012f95485519524a1b113853eb305bfc3d4900526b1255513617181","languages":["zh-CN","en-US"],"sampleUUID":"21000000-0000-4000-8000-000000000014","tags":["asr","local-only","mixed-language","names-terms","self-correction"]},{"assetReference":"local-corpus://product-synthetic/alpha-asr-v1/silence-four-seconds","consentClass":"synthetic","contentDigest":"4f308d971259dbecf58021548b71ad42dcb0447b9197390f62a51a1afc6f97fc","languages":["zh-CN","en-US"],"sampleUUID":"21000000-0000-4000-8000-000000000015","tags":["adversarial","asr","local-only","silence"]},{"assetReference":"local-corpus://product-synthetic/alpha-asr-v1/low-noise-four-seconds","consentClass":"synthetic","contentDigest":"8c27c80390cb2e5479bcd74f87eba601a0de5dab45cb5c120ff06e244492fef2","languages":["zh-CN","en-US"],"sampleUUID":"21000000-0000-4000-8000-000000000016","tags":["adversarial","asr","local-only","noise","silence"]}],"schemaVersion":1,"tier":"product-synthetic","version":"1.1.0"}
